{
  "schema_version": "1.0",
  "issuance_utc": "2026-10-17T00:00:00+00:00",
  "generated_at_utc": "2026-10-17T04:32:14+00:00",
  "data_cutoff_utc": "2026-10-16T19:00:00+00:00",
  "domain": {
    "id": "lahore",
    "name": {
      "en": "Lahore",
      "ur": "\u0644\u0627\u06c1\u0648\u0631"
    },
    "centroid": {
      "lat": 31.5204,
      "lon": 74.3587
    },
    "timezone": "Asia/Karachi"
  },
  "mode": "baseline_only",
  "mode_reason": "Automated pipeline run",
  "model": {
    "id": "m1_cams_raw",
    "version": "baseline",
    "git_sha": "unknown",
    "calibrated": false,
    "adaptation_status": "skipped_n0"
  },
  "aqi_scheme": "us_epa_2024_pm25_24h",
  "horizons": [
    {
      "lead_h": 24,
      "window_start_utc": "2026-10-17T00:00:00Z",
      "window_end_utc": "2026-10-18T00:00:00Z",
      "window_start_local": "2026-10-17T05:00:00+05:00",
      "window_end_local": "2026-10-18T05:00:00+05:00",
      "quantiles_ugm3": {
        "q05": 58.866599211462166,
        "q10": 58.866599211462166,
        "q25": 58.866599211462166,
        "q50": 58.866599211462166,
        "q75": 58.866599211462166,
        "q90": 58.866599211462166,
        "q95": 58.866599211462166
      },
      "category": {
        "lower_q10": "unhealthy",
        "median_q50": "unhealthy",
        "upper_q90": "unhealthy"
      },
      "probabilities": {
        "by_category": {
          "good": 0.0,
          "moderate": 0.0,
          "usg": 0.0,
          "unhealthy": 1.0,
          "very_unhealthy": 0.0,
          "hazardous": 0.0
        },
        "exceed": [
          {
            "threshold_ugm3": 55.5,
            "probability": 1.0
          },
          {
            "threshold_ugm3": 125.5,
            "probability": 0.0
          },
          {
            "threshold_ugm3": 225.5,
            "probability": 0.0
          }
        ]
      }
    },
    {
      "lead_h": 48,
      "window_start_utc": "2026-10-18T00:00:00Z",
      "window_end_utc": "2026-10-19T00:00:00Z",
      "window_start_local": "2026-10-18T05:00:00+05:00",
      "window_end_local": "2026-10-19T05:00:00+05:00",
      "quantiles_ugm3": {
        "q05": 50.66544845835477,
        "q10": 50.66544845835477,
        "q25": 50.66544845835477,
        "q50": 50.66544845835477,
        "q75": 50.66544845835477,
        "q90": 50.66544845835477,
        "q95": 50.66544845835477
      },
      "category": {
        "lower_q10": "usg",
        "median_q50": "usg",
        "upper_q90": "usg"
      },
      "probabilities": {
        "by_category": {
          "good": 0.0,
          "moderate": 0.0,
          "usg": 1.0,
          "unhealthy": 0.0,
          "very_unhealthy": 0.0,
          "hazardous": 0.0
        },
        "exceed": [
          {
            "threshold_ugm3": 55.5,
            "probability": 0.0
          },
          {
            "threshold_ugm3": 125.5,
            "probability": 0.0
          },
          {
            "threshold_ugm3": 225.5,
            "probability": 0.0
          }
        ]
      }
    },
    {
      "lead_h": 72,
      "window_start_utc": "2026-10-19T00:00:00Z",
      "window_end_utc": "2026-10-20T00:00:00Z",
      "window_start_local": "2026-10-19T05:00:00+05:00",
      "window_end_local": "2026-10-20T05:00:00+05:00",
      "quantiles_ugm3": {
        "q05": 59.691862715858015,
        "q10": 59.691862715858015,
        "q25": 59.691862715858015,
        "q50": 59.691862715858015,
        "q75": 59.691862715858015,
        "q90": 59.691862715858015,
        "q95": 59.691862715858015
      },
      "category": {
        "lower_q10": "unhealthy",
        "median_q50": "unhealthy",
        "upper_q90": "unhealthy"
      },
      "probabilities": {
        "by_category": {
          "good": 0.0,
          "moderate": 0.0,
          "usg": 0.0,
          "unhealthy": 1.0,
          "very_unhealthy": 0.0,
          "hazardous": 0.0
        },
        "exceed": [
          {
            "threshold_ugm3": 55.5,
            "probability": 1.0
          },
          {
            "threshold_ugm3": 125.5,
            "probability": 0.0
          },
          {
            "threshold_ugm3": 225.5,
            "probability": 0.0
          }
        ]
      }
    }
  ],
  "stations": [
    {
      "point_id": "station:8664",
      "name": "US Diplomatic Post: Lahore",
      "lat": 31.560078,
      "lon": 74.33589,
      "is_reference": true,
      "horizons": [
        {
          "lead_h": 24,
          "q10": 57.42025266044387,
          "q50": 57.42025266044387,
          "q90": 57.42025266044387,
          "category_median": "unhealthy"
        },
        {
          "lead_h": 48,
          "q10": 49.041456840776526,
          "q50": 49.041456840776526,
          "q90": 49.041456840776526,
          "category_median": "usg"
        },
        {
          "lead_h": 72,
          "q10": 57.979088458632646,
          "q50": 57.979088458632646,
          "q90": 57.979088458632646,
          "category_median": "unhealthy"
        }
      ]
    },
    {
      "point_id": "station:1894641",
      "name": "Lahore",
      "lat": 31.54815,
      "lon": 74.34396,
      "is_reference": false,
      "horizons": [
        {
          "lead_h": 24,
          "q10": 57.872303390512094,
          "q50": 57.872303390512094,
          "q90": 57.872303390512094,
          "category_median": "unhealthy"
        },
        {
          "lead_h": 48,
          "q10": 49.52430185726333,
          "q50": 49.52430185726333,
          "q90": 49.52430185726333,
          "category_median": "usg"
        },
        {
          "lead_h": 72,
          "q10": 58.4816788988098,
          "q50": 58.4816788988098,
          "q90": 58.4816788988098,
          "category_median": "unhealthy"
        }
      ]
    },
    {
      "point_id": "station:4515157",
      "name": "Barki, Lahore",
      "lat": 31.4591591,
      "lon": 74.5396309,
      "is_reference": false,
      "horizons": [
        {
          "lead_h": 24,
          "q10": 58.60045876329684,
          "q50": 58.60045876329684,
          "q90": 58.60045876329684,
          "category_median": "unhealthy"
        },
        {
          "lead_h": 48,
          "q10": 51.225748185180464,
          "q50": 51.225748185180464,
          "q90": 51.225748185180464,
          "category_median": "usg"
        },
        {
          "lead_h": 72,
          "q10": 58.749038102699664,
          "q50": 58.749038102699664,
          "q90": 58.749038102699664,
          "category_median": "unhealthy"
        }
      ]
    },
    {
      "point_id": "station:4527035",
      "name": "Civil Secretariat",
      "lat": 31.565942,
      "lon": 74.2993626,
      "is_reference": false,
      "horizons": [
        {
          "lead_h": 24,
          "q10": 56.58712340814427,
          "q50": 56.58712340814427,
          "q90": 56.58712340814427,
          "category_median": "unhealthy"
        },
        {
          "lead_h": 48,
          "q10": 48.7586246798838,
          "q50": 48.7586246798838,
          "q90": 48.7586246798838,
          "category_median": "usg"
        },
        {
          "lead_h": 72,
          "q10": 57.85749153017489,
          "q50": 57.85749153017489,
          "q90": 57.85749153017489,
          "category_median": "unhealthy"
        }
      ]
    },
    {
      "point_id": "station:4527173",
      "name": "Learning Alliance Intl. DHA",
      "lat": 31.525621,
      "lon": 74.436078,
      "is_reference": false,
      "horizons": [
        {
          "lead_h": 24,
          "q10": 59.00333559712151,
          "q50": 59.00333559712151,
          "q90": 59.00333559712151,
          "category_median": "unhealthy"
        },
        {
          "lead_h": 48,
          "q10": 50.14427831856339,
          "q50": 50.14427831856339,
          "q90": 50.14427831856339,
          "category_median": "usg"
        },
        {
          "lead_h": 72,
          "q10": 58.4850655556401,
          "q50": 58.4850655556401,
          "q90": 58.4850655556401,
          "category_median": "unhealthy"
        }
      ]
    },
    {
      "point_id": "station:4527306",
      "name": "FOOT & MOUTH DISEASE RESEARCH CENTRE",
      "lat": 31.53574,
      "lon": 74.43538,
      "is_reference": false,
      "horizons": [
        {
          "lead_h": 24,
          "q10": 58.76432375980031,
          "q50": 58.76432375980031,
          "q90": 58.76432375980031,
          "category_median": "unhealthy"
        },
        {
          "lead_h": 48,
          "q10": 49.74697713556291,
          "q50": 49.74697713556291,
          "q90": 49.74697713556291,
          "category_median": "usg"
        },
        {
          "lead_h": 72,
          "q10": 58.03773532866853,
          "q50": 58.03773532866853,
          "q90": 58.03773532866853,
          "category_median": "unhealthy"
        }
      ]
    },
    {
      "point_id": "station:4527402",
      "name": "HBFC Society, DHA Phase 5 (Hussainy House)",
      "lat": 31.4571645,
      "lon": 74.4106586,
      "is_reference": false,
      "horizons": [
        {
          "lead_h": 24,
          "q10": 61.19527625642488,
          "q50": 61.19527625642488,
          "q90": 61.19527625642488,
          "category_median": "unhealthy"
        },
        {
          "lead_h": 48,
          "q10": 53.27889210527198,
          "q50": 53.27889210527198,
          "q90": 53.27889210527198,
          "category_median": "usg"
        },
        {
          "lead_h": 72,
          "q10": 62.312102248974206,
          "q50": 62.312102248974206,
          "q90": 62.312102248974206,
          "category_median": "unhealthy"
        }
      ]
    },
    {
      "point_id": "station:4535267",
      "name": "Gajju Matta (Kahna)",
      "lat": 31.377378,
      "lon": 74.350574,
      "is_reference": false,
      "horizons": [
        {
          "lead_h": 24,
          "q10": 62.31169836793125,
          "q50": 62.31169836793125,
          "q90": 62.31169836793125,